<?xml version = "1.0" encoding = "utf-8"?>
<!DOCTYPE library SYSTEM "library.dtd">
<library>
	<book_catalog>
		<book id = "ID" isbn = " " year = " " issue = "translate">
			<authors>
				<author></author>
			</authors>
			<title></title>
			<publishing></publishing>
			<annotation></annotation>
		</book>
	</book_catalog>
	<author_catalog>
		<author_book idref = " "/>
	</author_catalog>
</library>
